{
  "id": "video-games",
  "label": "Jeux vidéo",
  "description": "Jeux, consoles, personnages et culture vidéoludique",
  "icon": "🎮",
  "category": "Pop culture & loisirs",
  "weight": 2,
  "subthemes": [
    {
      "id": "video-games:essentials",
      "label": "Les essentiels",
      "description": "Références immédiatement associées au thème"
    },
    {
      "id": "video-games:people",
      "label": "Personnes & personnages",
      "description": "Personnes réelles ou fictives liées au thème"
    },
    {
      "id": "video-games:places",
      "label": "Lieux & destinations",
      "description": "Lieux, régions et espaces liés au thème"
    },
    {
      "id": "video-games:objects",
      "label": "Objets & produits",
      "description": "Objets, produits et éléments concrets du thème"
    },
    {
      "id": "video-games:situations",
      "label": "Usages & situations",
      "description": "Actions, habitudes et situations typiques du thème"
    }
  ],
  "tags": [
    "essentials",
    "people",
    "places",
    "objects",
    "situations"
  ],
  "contentVersion": "2026.08.17-excel-import"
}
