{
  "id": "internet-social",
  "label": "Internet, réseaux & tendances",
  "description": "Web, réseaux sociaux, usages et tendances numériques",
  "icon": "📱",
  "category": "Pop culture & loisirs",
  "weight": 2,
  "subthemes": [
    {
      "id": "internet-social:essentials",
      "label": "Les essentiels",
      "description": "Références immédiatement associées au thème"
    },
    {
      "id": "internet-social:people",
      "label": "Personnes & personnages",
      "description": "Personnes réelles ou fictives liées au thème"
    },
    {
      "id": "internet-social:places",
      "label": "Lieux & destinations",
      "description": "Lieux, régions et espaces liés au thème"
    },
    {
      "id": "internet-social:objects",
      "label": "Objets & produits",
      "description": "Objets, produits et éléments concrets du thème"
    },
    {
      "id": "internet-social:situations",
      "label": "Usages & situations",
      "description": "Actions, habitudes et situations typiques du thème"
    }
  ],
  "tags": ["essentials", "people", "places", "objects", "situations"],
  "contentVersion": "2026.08.17-excel-import"
}
