{
  "id": "home-diy",
  "label": "Maison, objets & bricolage",
  "description": "Pièces, objets domestiques, entretien et bricolage",
  "icon": "🏠",
  "category": "Vie quotidienne & société",
  "weight": 3,
  "subthemes": [
    {
      "id": "home-diy:essentials",
      "label": "Les essentiels",
      "description": "Références immédiatement associées au thème"
    },
    {
      "id": "home-diy:people",
      "label": "Personnes & personnages",
      "description": "Personnes réelles ou fictives liées au thème"
    },
    {
      "id": "home-diy:places",
      "label": "Lieux & destinations",
      "description": "Lieux, régions et espaces liés au thème"
    },
    {
      "id": "home-diy:objects",
      "label": "Objets & produits",
      "description": "Objets, produits et éléments concrets du thème"
    },
    {
      "id": "home-diy:situations",
      "label": "Usages & situations",
      "description": "Actions, habitudes et situations typiques du thème"
    }
  ],
  "tags": [
    "essentials",
    "people",
    "places",
    "objects",
    "situations"
  ],
  "contentVersion": "2026.08.17-excel-import"
}
