{
  "id": "music",
  "label": "Musique",
  "description": "Artistes, chansons, instruments et univers musicaux",
  "icon": "🎵",
  "category": "Pop culture & loisirs",
  "weight": 6,
  "subthemes": [
    {
      "id": "music:essentials",
      "label": "Les essentiels",
      "description": "Références immédiatement associées au thème"
    },
    {
      "id": "music:people",
      "label": "Personnes & personnages",
      "description": "Personnes réelles ou fictives liées au thème"
    },
    {
      "id": "music:places",
      "label": "Lieux & destinations",
      "description": "Lieux, régions et espaces liés au thème"
    },
    {
      "id": "music:objects",
      "label": "Objets & produits",
      "description": "Objets, produits et éléments concrets du thème"
    },
    {
      "id": "music:situations",
      "label": "Usages & situations",
      "description": "Actions, habitudes et situations typiques du thème"
    }
  ],
  "tags": [
    "essentials",
    "people",
    "places",
    "objects",
    "situations"
  ],
  "contentVersion": "2026.08.17-excel-import"
}
