{
  "id": "arts-literature",
  "label": "Arts, littérature & patrimoine",
  "description": "Œuvres, artistes, récits et patrimoine culturel",
  "icon": "🎨",
  "category": "Culture générale accessible",
  "weight": 6,
  "subthemes": [
    {
      "id": "arts-literature:essentials",
      "label": "Les essentiels",
      "description": "Références immédiatement associées au thème"
    },
    {
      "id": "arts-literature:people",
      "label": "Personnes & personnages",
      "description": "Personnes réelles ou fictives liées au thème"
    },
    {
      "id": "arts-literature:places",
      "label": "Lieux & destinations",
      "description": "Lieux, régions et espaces liés au thème"
    },
    {
      "id": "arts-literature:objects",
      "label": "Objets & produits",
      "description": "Objets, produits et éléments concrets du thème"
    },
    {
      "id": "arts-literature:situations",
      "label": "Usages & situations",
      "description": "Actions, habitudes et situations typiques du thème"
    }
  ],
  "tags": [
    "essentials",
    "people",
    "places",
    "objects",
    "situations"
  ],
  "contentVersion": "2026.08.17-excel-import"
}
