{
  "id": "geography-world",
  "label": "Géographie, pays & monde",
  "description": "Pays, villes, paysages et repères du monde",
  "icon": "🌍",
  "category": "Culture générale accessible",
  "weight": 7,
  "subthemes": [
    {
      "id": "geography-world:essentials",
      "label": "Les essentiels",
      "description": "Références immédiatement associées au thème"
    },
    {
      "id": "geography-world:people",
      "label": "Personnes & personnages",
      "description": "Personnes réelles ou fictives liées au thème"
    },
    {
      "id": "geography-world:places",
      "label": "Lieux & destinations",
      "description": "Lieux, régions et espaces liés au thème"
    },
    {
      "id": "geography-world:objects",
      "label": "Objets & produits",
      "description": "Objets, produits et éléments concrets du thème"
    },
    {
      "id": "geography-world:situations",
      "label": "Usages & situations",
      "description": "Actions, habitudes et situations typiques du thème"
    }
  ],
  "tags": ["essentials", "people", "places", "objects", "situations"],
  "contentVersion": "2026.08.17-excel-import"
}
