{
  "id": "cinema",
  "label": "Cinéma",
  "description": "Films, personnages, sagas et métiers du cinéma",
  "icon": "🎬",
  "category": "Pop culture & loisirs",
  "weight": 3,
  "subthemes": [
    {
      "id": "cinema:essentials",
      "label": "Les essentiels",
      "description": "Références immédiatement associées au thème"
    },
    {
      "id": "cinema:people",
      "label": "Personnes & personnages",
      "description": "Personnes réelles ou fictives liées au thème"
    },
    {
      "id": "cinema:places",
      "label": "Lieux & destinations",
      "description": "Lieux, régions et espaces liés au thème"
    },
    {
      "id": "cinema:objects",
      "label": "Objets & produits",
      "description": "Objets, produits et éléments concrets du thème"
    },
    {
      "id": "cinema:situations",
      "label": "Usages & situations",
      "description": "Actions, habitudes et situations typiques du thème"
    }
  ],
  "tags": ["essentials", "people", "places", "objects", "situations"],
  "contentVersion": "2026.08.17-excel-import"
}
