{
  "id": "fashion-beauty",
  "label": "Mode, beauté & style",
  "description": "Vêtements, accessoires, beauté et styles",
  "icon": "👗",
  "category": "Vie quotidienne & société",
  "weight": 2,
  "subthemes": [
    {
      "id": "fashion-beauty:essentials",
      "label": "Les essentiels",
      "description": "Références immédiatement associées au thème"
    },
    {
      "id": "fashion-beauty:people",
      "label": "Personnes & personnages",
      "description": "Personnes réelles ou fictives liées au thème"
    },
    {
      "id": "fashion-beauty:places",
      "label": "Lieux & destinations",
      "description": "Lieux, régions et espaces liés au thème"
    },
    {
      "id": "fashion-beauty:objects",
      "label": "Objets & produits",
      "description": "Objets, produits et éléments concrets du thème"
    },
    {
      "id": "fashion-beauty:situations",
      "label": "Usages & situations",
      "description": "Actions, habitudes et situations typiques du thème"
    }
  ],
  "tags": [
    "essentials",
    "people",
    "places",
    "objects",
    "situations"
  ],
  "contentVersion": "2026.08.17-excel-import"
}
