{
  "id": "party-alcohol",
  "label": "Soirées, alcool & fête",
  "description": "Fêtes, sorties, boissons et situations de soirée",
  "icon": "🥂",
  "category": "Vie quotidienne & société",
  "weight": 3,
  "subthemes": [
    {
      "id": "party-alcohol:essentials",
      "label": "Les essentiels",
      "description": "Références immédiatement associées au thème"
    },
    {
      "id": "party-alcohol:people",
      "label": "Personnes & personnages",
      "description": "Personnes réelles ou fictives liées au thème"
    },
    {
      "id": "party-alcohol:places",
      "label": "Lieux & destinations",
      "description": "Lieux, régions et espaces liés au thème"
    },
    {
      "id": "party-alcohol:objects",
      "label": "Objets & produits",
      "description": "Objets, produits et éléments concrets du thème"
    },
    {
      "id": "party-alcohol:situations",
      "label": "Usages & situations",
      "description": "Actions, habitudes et situations typiques du thème"
    }
  ],
  "tags": [
    "essentials",
    "people",
    "places",
    "objects",
    "situations"
  ],
  "contentVersion": "2026.08.17-excel-import"
}
