{
  "id": "games-entertainment",
  "label": "Jeux, jouets & divertissements",
  "description": "Jeux de société, jouets et divertissements populaires",
  "icon": "🎲",
  "category": "Pop culture & loisirs",
  "weight": 2,
  "subthemes": [
    {
      "id": "games-entertainment:essentials",
      "label": "Les essentiels",
      "description": "Références immédiatement associées au thème"
    },
    {
      "id": "games-entertainment:people",
      "label": "Personnes & personnages",
      "description": "Personnes réelles ou fictives liées au thème"
    },
    {
      "id": "games-entertainment:places",
      "label": "Lieux & destinations",
      "description": "Lieux, régions et espaces liés au thème"
    },
    {
      "id": "games-entertainment:objects",
      "label": "Objets & produits",
      "description": "Objets, produits et éléments concrets du thème"
    },
    {
      "id": "games-entertainment:situations",
      "label": "Usages & situations",
      "description": "Actions, habitudes et situations typiques du thème"
    }
  ],
  "tags": [
    "essentials",
    "people",
    "places",
    "objects",
    "situations"
  ],
  "contentVersion": "2026.08.17-excel-import"
}
