{
  "id": "records-rankings",
  "label": "Records, classements & faits marquants",
  "description": "Records connus, grands classements et faits marquants",
  "icon": "🏆",
  "category": "Culture générale accessible",
  "weight": 7,
  "subthemes": [
    {
      "id": "records-rankings:essentials",
      "label": "Les essentiels",
      "description": "Références immédiatement associées au thème"
    },
    {
      "id": "records-rankings:people",
      "label": "Personnes & personnages",
      "description": "Personnes réelles ou fictives liées au thème"
    },
    {
      "id": "records-rankings:places",
      "label": "Lieux & destinations",
      "description": "Lieux, régions et espaces liés au thème"
    },
    {
      "id": "records-rankings:objects",
      "label": "Objets & produits",
      "description": "Objets, produits et éléments concrets du thème"
    },
    {
      "id": "records-rankings:situations",
      "label": "Usages & situations",
      "description": "Actions, habitudes et situations typiques du thème"
    }
  ],
  "tags": ["essentials", "people", "places", "objects", "situations"],
  "contentVersion": "2026.08.17-excel-import"
}
